{
  "schema_version": "dic-report-v2",
  "run_id": "80c94a2eb9384d2a948fb64901ada60a",
  "fault_id": null,
  "source_artifacts": {
    "trips_sha256": "c4d59da7bbc8abaeeeb1727947ee93d9891a71acb42854bd80db1571b2030510",
    "lookup_sha256": "1a99e105092230f8620f301edcca7f80d3080642ff404d28ed957d3fa222c8ed",
    "reference_lookup_sha256": "1a99e105092230f8620f301edcca7f80d3080642ff404d28ed957d3fa222c8ed",
    "contract_sha256": "947e696d07ed07482a9d542febf5a345693e5a1a29b4db5875dc0fbdeca3c953"
  },
  "contract_id": "dic-taxi-pipeline-v1",
  "contract_version": 2,
  "contract_hash": "947e696d07ed07482a9d542febf5a345693e5a1a29b4db5875dc0fbdeca3c953",
  "outcome": "passed",
  "cleaning": {
    "rejection_attribution": "first_failing_rule",
    "total_rejected_rows": 94436,
    "rejected_rows_by_rule": {
      "pickup_timestamp_present": 0,
      "pickup_timestamp_parseable": 0,
      "dropoff_timestamp_present": 0,
      "dropoff_timestamp_parseable": 0,
      "pickup_zone_present": 0,
      "nonnegative_fare": 37448,
      "positive_distance": 56988
    }
  },
  "checks": [
    {
      "id": "lookup_non_null_unique",
      "severity": "block",
      "passed": true,
      "null_key_rows": 0,
      "duplicate_keys": {}
    },
    {
      "id": "reference_lookup_non_null_unique",
      "severity": "block",
      "passed": true,
      "null_key_rows": 0,
      "duplicate_keys": {}
    },
    {
      "id": "left_join_row_count_conservation",
      "severity": "block",
      "passed": true,
      "input_rows": 2870188,
      "expected_rows": 2870188,
      "observed_rows": 2870188
    },
    {
      "id": "join_cardinality",
      "severity": "block",
      "passed": true,
      "policy": "many_to_one",
      "multiple_match_input_rows": 0
    },
    {
      "id": "join_key_non_null",
      "severity": "block",
      "passed": true,
      "null_key_rows": 0,
      "key": "PULocationID"
    },
    {
      "id": "unmatched_lookup_keys",
      "severity": "info",
      "passed": true,
      "policy": "exclude",
      "unmatched_rows": 0
    }
  ],
  "evidence": {
    "matched_rows": 2870188,
    "unmatched_rows": 0,
    "multiple_match_input_rows": 0,
    "affected_key": null,
    "key_multiplicities": {
      "lookup": {},
      "original_reference": {
        "1": 1,
        "2": 1,
        "3": 1,
        "4": 1,
        "5": 1,
        "6": 1,
        "7": 1,
        "8": 1,
        "9": 1,
        "10": 1,
        "11": 1,
        "12": 1,
        "13": 1,
        "14": 1,
        "15": 1,
        "16": 1,
        "17": 1,
        "18": 1,
        "19": 1,
        "20": 1,
        "21": 1,
        "22": 1,
        "23": 1,
        "24": 1,
        "25": 1,
        "26": 1,
        "27": 1,
        "28": 1,
        "29": 1,
        "30": 1,
        "31": 1,
        "32": 1,
        "33": 1,
        "34": 1,
        "35": 1,
        "36": 1,
        "37": 1,
        "38": 1,
        "39": 1,
        "40": 1,
        "41": 1,
        "42": 1,
        "43": 1,
        "44": 1,
        "45": 1,
        "46": 1,
        "47": 1,
        "48": 1,
        "49": 1,
        "50": 1,
        "51": 1,
        "52": 1,
        "53": 1,
        "54": 1,
        "55": 1,
        "56": 1,
        "57": 1,
        "58": 1,
        "59": 1,
        "60": 1,
        "61": 1,
        "62": 1,
        "63": 1,
        "64": 1,
        "65": 1,
        "66": 1,
        "67": 1,
        "68": 1,
        "69": 1,
        "70": 1,
        "71": 1,
        "72": 1,
        "73": 1,
        "74": 1,
        "75": 1,
        "76": 1,
        "77": 1,
        "78": 1,
        "79": 1,
        "80": 1,
        "81": 1,
        "82": 1,
        "83": 1,
        "84": 1,
        "85": 1,
        "86": 1,
        "87": 1,
        "88": 1,
        "89": 1,
        "90": 1,
        "91": 1,
        "92": 1,
        "93": 1,
        "94": 1,
        "95": 1,
        "96": 1,
        "97": 1,
        "98": 1,
        "99": 1,
        "100": 1,
        "101": 1,
        "102": 1,
        "103": 1,
        "104": 1,
        "105": 1,
        "106": 1,
        "107": 1,
        "108": 1,
        "109": 1,
        "110": 1,
        "111": 1,
        "112": 1,
        "113": 1,
        "114": 1,
        "115": 1,
        "116": 1,
        "117": 1,
        "118": 1,
        "119": 1,
        "120": 1,
        "121": 1,
        "122": 1,
        "123": 1,
        "124": 1,
        "125": 1,
        "126": 1,
        "127": 1,
        "128": 1,
        "129": 1,
        "130": 1,
        "131": 1,
        "132": 1,
        "133": 1,
        "134": 1,
        "135": 1,
        "136": 1,
        "137": 1,
        "138": 1,
        "139": 1,
        "140": 1,
        "141": 1,
        "142": 1,
        "143": 1,
        "144": 1,
        "145": 1,
        "146": 1,
        "147": 1,
        "148": 1,
        "149": 1,
        "150": 1,
        "151": 1,
        "152": 1,
        "153": 1,
        "154": 1,
        "155": 1,
        "156": 1,
        "157": 1,
        "158": 1,
        "159": 1,
        "160": 1,
        "161": 1,
        "162": 1,
        "163": 1,
        "164": 1,
        "165": 1,
        "166": 1,
        "167": 1,
        "168": 1,
        "169": 1,
        "170": 1,
        "171": 1,
        "172": 1,
        "173": 1,
        "174": 1,
        "175": 1,
        "176": 1,
        "177": 1,
        "178": 1,
        "179": 1,
        "180": 1,
        "181": 1,
        "182": 1,
        "183": 1,
        "184": 1,
        "185": 1,
        "186": 1,
        "187": 1,
        "188": 1,
        "189": 1,
        "190": 1,
        "191": 1,
        "192": 1,
        "193": 1,
        "194": 1,
        "195": 1,
        "196": 1,
        "197": 1,
        "198": 1,
        "199": 1,
        "200": 1,
        "201": 1,
        "202": 1,
        "203": 1,
        "204": 1,
        "205": 1,
        "206": 1,
        "207": 1,
        "208": 1,
        "209": 1,
        "210": 1,
        "211": 1,
        "212": 1,
        "213": 1,
        "214": 1,
        "215": 1,
        "216": 1,
        "217": 1,
        "218": 1,
        "219": 1,
        "220": 1,
        "221": 1,
        "222": 1,
        "223": 1,
        "224": 1,
        "225": 1,
        "226": 1,
        "227": 1,
        "228": 1,
        "229": 1,
        "230": 1,
        "231": 1,
        "232": 1,
        "233": 1,
        "234": 1,
        "235": 1,
        "236": 1,
        "237": 1,
        "238": 1,
        "239": 1,
        "240": 1,
        "241": 1,
        "242": 1,
        "243": 1,
        "244": 1,
        "245": 1,
        "246": 1,
        "247": 1,
        "248": 1,
        "249": 1,
        "250": 1,
        "251": 1,
        "252": 1,
        "253": 1,
        "254": 1,
        "255": 1,
        "256": 1,
        "257": 1,
        "258": 1,
        "259": 1,
        "260": 1,
        "261": 1,
        "262": 1,
        "263": 1,
        "264": 1,
        "265": 1
      }
    },
    "affected_input_rows": 0,
    "preexisting_source_violations": {
      "null_key_rows": 0,
      "duplicate_keys": {}
    },
    "earliest_divergence": null,
    "suspected_transformation": null,
    "attribution": "none",
    "diagnostic_limitations": [
      "single batch run; no temporal divergence tracking",
      "join fault localization is not a root-cause accuracy benchmark"
    ]
  },
  "expected_observed": {
    "expected_clean_output_rows": 2870188,
    "observed_diagnostic_output_rows": 2870188,
    "expected_row_inflation_from_new_duplicate_keys": 0,
    "observed_row_inflation": 0,
    "row_inflation": 0,
    "formula": "sum(N_k * (lookup_multiplicity - reference_multiplicity))"
  },
  "downstream_aggregate_deltas": [],
  "publication": {
    "decision": "published",
    "pointer_before": "bc83f61d30d44ce68854a32e5697ef66",
    "pointer_after": "80c94a2eb9384d2a948fb64901ada60a"
  },
  "runtimes_seconds": {
    "total_pipeline_seconds": 7.47238,
    "validation_seconds": 0.583536,
    "output_materialization_seconds": 4.82861,
    "publication_seconds": 0.025758
  },
  "peak_memory": {
    "metric": "peak_working_set",
    "platform": "Linux-6.18.55+-x86_64-with-glibc2.39",
    "scope": "dedicated_experiment_process",
    "status": "available",
    "value_bytes": 3229642752,
    "method": "resource.getrusage(RUSAGE_SELF).ru_maxrss",
    "native_units": "KiB",
    "conversion": "KiB multiplied by 1024"
  },
  "versions": {
    "compiler": "0.1.0",
    "python": "3.13.15",
    "duckdb": "1.2.2",
    "contract": "2",
    "cleaning": "2"
  },
  "row_counts": {
    "raw_trips": 2964624,
    "clean_trips": 2870188,
    "diagnostic_left_join": 2870188,
    "matched_rows": 2870188,
    "unmatched_rows": 0,
    "multiple_match_input_rows": 0,
    "enriched_candidate_rows": 2870188
  },
  "logical_output_hashes": {
    "clean_trips": "rows=2870188;logical_hash=26490451740393269596323632",
    "diagnostic_join": "rows=2870188;logical_hash=26463450733751842287672676",
    "trip_enriched": "rows=2870188;logical_hash=26463450733751842287672676",
    "daily_zone_metrics": "rows=6859;logical_hash=62962878196720618869686"
  }
}